meta,id,name,description,mitra_id,start_period,months_duration,activity_type,location,fields_of_study,quota,min_semester,skills,web_portal,show_salary,mobilization,accommodation,is_applied,wishlist,is_external,external_platform_name,external_platform_logo_url,salary
,dcc09e11-32aa-4410-bbca-bbaf1a1dfa2f,Manajemen Bisnis,"Program ini bertujuan untuk mengembangkan green manufacturing dengan pendekatan research pada PT Kalimaya Alunna Indonesia melalui inovasi produk olahan kurma. Program ini akan mempertimbangkan prinsip-prinsip lingkungan dalam proses produksi untuk meningkatkan efisiensi energi, mengurangi limbah, dan meminimalkan dampak negatif terhadap lingkungan. Salah satu fokus utama dari program ini adalah mengembangkan inovasi produk olahan kurma yang lebih ramah lingkungan. Hal ini dapat dicapai dengan memanfaatkan teknologi hijau dalam proses produksi, seperti penggunaan sumber energi terbarukan dan proses produksi yang lebih efisien. Selain itu, program ini juga akan mempertimbangkan penggunaan bahan baku yang ramah lingkungan dan berkelanjutan untuk produk olahan kurma. Selain mempertimbangkan aspek lingkungan, program ini juga akan mengejar peningkatan kualitas produk dan keunggulan kompetitif PT Kalimaya Alunna Indonesia di pasar domestik dan internasional. Melalui inovasi produk olahan kurma yang lebih baik, PT Kalimaya Alunna Indonesia dapat meningkatkan daya saingnya di pasar dan memperluas pangsa pasar di dalam dan luar negeri. Program ini juga akan melibatkan penelitian dan pengembangan dalam proses pengembangan inovasi produk olahan kurma yang ramah lingkungan dan berkualitas tinggi. Dengan memanfaatkan penelitian dan pengembangan, program ini diharapkan dapat menciptakan produk-produk olahan kurma yang inovatif, efektif, dan efisien serta dapat meningkatkan efektivitas produksi, daya saing, dan keuntungan bagi PT Kalimaya Alunna Indonesia.",7d7e5fa4-c1d3-48b5-9494-9e5287e5f004,2024-02-01T00:00:00+07:00,4,HYBRID,Kab. Klaten,[],4,5,"['Manajemen Keuangan', 'Manajemen Hubungan Pelanggan', 'Manajemen Pemasaran', 'Manajemen Perkantoran', 'Business Development']",,False,True,False,False,False,False,,,
,b530d77b-049b-4fa4-812a-adacd531a2b7,Marketing Assistant,"Program ini bertujuan untuk mengembangkan green manufacturing dengan pendekatan research pada PT Kalimaya Alunna Indonesia melalui inovasi produk olahan kurma. Program ini akan mempertimbangkan prinsip-prinsip lingkungan dalam proses produksi untuk meningkatkan efisiensi energi, mengurangi limbah, dan meminimalkan dampak negatif terhadap lingkungan. Salah satu fokus utama dari program ini adalah mengembangkan inovasi produk olahan kurma yang lebih ramah lingkungan. Hal ini dapat dicapai dengan memanfaatkan teknologi hijau dalam proses produksi, seperti penggunaan sumber energi terbarukan dan proses produksi yang lebih efisien. Selain itu, program ini juga akan mempertimbangkan penggunaan bahan baku yang ramah lingkungan dan berkelanjutan untuk produk olahan kurma. Selain mempertimbangkan aspek lingkungan, program ini juga akan mengejar peningkatan kualitas produk dan keunggulan kompetitif PT Kalimaya Alunna Indonesia di pasar domestik dan internasional. Melalui inovasi produk olahan kurma yang lebih baik, PT Kalimaya Alunna Indonesia dapat meningkatkan daya saingnya di pasar dan memperluas pangsa pasar di dalam dan luar negeri. Program ini juga akan melibatkan penelitian dan pengembangan dalam proses pengembangan inovasi produk olahan kurma yang ramah lingkungan dan berkualitas tinggi. Dengan memanfaatkan penelitian dan pengembangan, program ini diharapkan dapat menciptakan produk-produk olahan kurma yang inovatif, efektif, dan efisien serta dapat meningkatkan efektivitas produksi, daya saing, dan keuntungan bagi PT Kalimaya Alunna Indonesia.",7d7e5fa4-c1d3-48b5-9494-9e5287e5f004,2024-02-01T00:00:00+07:00,4,HYBRID,Kab. Klaten,[],2,5,"['Analisis Pasar', 'Kemampuan Analitis', 'Pemasaran dan Promosi', 'Creative Marketing', 'Keterampilan Komunikasi']",,False,True,False,False,False,False,,,
,7c87eab6-0b49-4edf-9d90-794b43fcfdcb,Food Technology,"Program ini bertujuan untuk mengembangkan green manufacturing dengan pendekatan research pada PT Kalimaya Alunna Indonesia melalui inovasi produk olahan kurma. Program ini akan mempertimbangkan prinsip-prinsip lingkungan dalam proses produksi untuk meningkatkan efisiensi energi, mengurangi limbah, dan meminimalkan dampak negatif terhadap lingkungan. Salah satu fokus utama dari program ini adalah mengembangkan inovasi produk olahan kurma yang lebih ramah lingkungan. Hal ini dapat dicapai dengan memanfaatkan teknologi hijau dalam proses produksi, seperti penggunaan sumber energi terbarukan dan proses produksi yang lebih efisien. Selain itu, program ini juga akan mempertimbangkan penggunaan bahan baku yang ramah lingkungan dan berkelanjutan untuk produk olahan kurma. Selain mempertimbangkan aspek lingkungan, program ini juga akan mengejar peningkatan kualitas produk dan keunggulan kompetitif PT Kalimaya Alunna Indonesia di pasar domestik dan internasional. Melalui inovasi produk olahan kurma yang lebih baik, PT Kalimaya Alunna Indonesia dapat meningkatkan daya saingnya di pasar dan memperluas pangsa pasar di dalam dan luar negeri. Program ini juga akan melibatkan penelitian dan pengembangan dalam proses pengembangan inovasi produk olahan kurma yang ramah lingkungan dan berkualitas tinggi. Dengan memanfaatkan penelitian dan pengembangan, program ini diharapkan dapat menciptakan produk-produk olahan kurma yang inovatif, efektif, dan efisien serta dapat meningkatkan efektivitas produksi, daya saing, dan keuntungan bagi PT Kalimaya Alunna Indonesia.",7d7e5fa4-c1d3-48b5-9494-9e5287e5f004,2024-02-01T00:00:00+07:00,4,HYBRID,Kab. Klaten,[],3,0,"['Pengawasan Mutu', 'Food Engineering', 'Sanitasi dan Keamanan pada proses Pengolahan', 'Penyimpanan dan Manajemen Pergudangan ', 'Teknologi Proses Pengolahan']",,False,True,False,False,False,False,,,
,a8a98e4d-930c-4721-a24c-18e4404a82d4,Social Media Specialist,"Program ini bertujuan untuk mengembangkan green manufacturing dengan pendekatan research pada PT Kalimaya Alunna Indonesia melalui inovasi produk olahan kurma. Program ini akan mempertimbangkan prinsip-prinsip lingkungan dalam proses produksi untuk meningkatkan efisiensi energi, mengurangi limbah, dan meminimalkan dampak negatif terhadap lingkungan. Salah satu fokus utama dari program ini adalah mengembangkan inovasi produk olahan kurma yang lebih ramah lingkungan. Hal ini dapat dicapai dengan memanfaatkan teknologi hijau dalam proses produksi, seperti penggunaan sumber energi terbarukan dan proses produksi yang lebih efisien. Selain itu, program ini juga akan mempertimbangkan penggunaan bahan baku yang ramah lingkungan dan berkelanjutan untuk produk olahan kurma. Selain mempertimbangkan aspek lingkungan, program ini juga akan mengejar peningkatan kualitas produk dan keunggulan kompetitif PT Kalimaya Alunna Indonesia di pasar domestik dan internasional. Melalui inovasi produk olahan kurma yang lebih baik, PT Kalimaya Alunna Indonesia dapat meningkatkan daya saingnya di pasar dan memperluas pangsa pasar di dalam dan luar negeri. Program ini juga akan melibatkan penelitian dan pengembangan dalam proses pengembangan inovasi produk olahan kurma yang ramah lingkungan dan berkualitas tinggi. Dengan memanfaatkan penelitian dan pengembangan, program ini diharapkan dapat menciptakan produk-produk olahan kurma yang inovatif, efektif, dan efisien serta dapat meningkatkan efektivitas produksi, daya saing, dan keuntungan bagi PT Kalimaya Alunna Indonesia.",7d7e5fa4-c1d3-48b5-9494-9e5287e5f004,2024-02-01T00:00:00+07:00,4,HYBRID,Kab. Klaten,[],2,5,"['Pemasaran E-commerce', 'Digital Marketer', 'Copywriter', 'Konten Kreator', 'Social Media Officer']",,False,True,False,False,False,False,,,
,fd2aa3aa-0927-4f1b-9afb-0762c4327b0a,Research and Development (R&D),"Program ini bertujuan untuk mengembangkan green manufacturing dengan pendekatan research pada PT Kalimaya Alunna Indonesia melalui inovasi produk olahan kurma. Program ini akan mempertimbangkan prinsip-prinsip lingkungan dalam proses produksi untuk meningkatkan efisiensi energi, mengurangi limbah, dan meminimalkan dampak negatif terhadap lingkungan. Salah satu fokus utama dari program ini adalah mengembangkan inovasi produk olahan kurma yang lebih ramah lingkungan. Hal ini dapat dicapai dengan memanfaatkan teknologi hijau dalam proses produksi, seperti penggunaan sumber energi terbarukan dan proses produksi yang lebih efisien. Selain itu, program ini juga akan mempertimbangkan penggunaan bahan baku yang ramah lingkungan dan berkelanjutan untuk produk olahan kurma. Selain mempertimbangkan aspek lingkungan, program ini juga akan mengejar peningkatan kualitas produk dan keunggulan kompetitif PT Kalimaya Alunna Indonesia di pasar domestik dan internasional. Melalui inovasi produk olahan kurma yang lebih baik, PT Kalimaya Alunna Indonesia dapat meningkatkan daya saingnya di pasar dan memperluas pangsa pasar di dalam dan luar negeri. Program ini juga akan melibatkan penelitian dan pengembangan dalam proses pengembangan inovasi produk olahan kurma yang ramah lingkungan dan berkualitas tinggi. Dengan memanfaatkan penelitian dan pengembangan, program ini diharapkan dapat menciptakan produk-produk olahan kurma yang inovatif, efektif, dan efisien serta dapat meningkatkan efektivitas produksi, daya saing, dan keuntungan bagi PT Kalimaya Alunna Indonesia.",7d7e5fa4-c1d3-48b5-9494-9e5287e5f004,2024-02-01T00:00:00+07:00,4,HYBRID,Kab. Klaten,[],4,5,"['Manajemen Proyek', 'Keterampilan Komputer', 'Analisis Data', 'Penelitian dan Pengembangan Produk', 'Komunikasi Bisnis']",,False,True,False,False,False,False,,,
,e20bfe70-55af-4fea-a858-d1de5de4bf7a,Pemasaran,"Seorang Spesialis Pemasaran bertanggung jawab untuk merancang, melaksanakan, dan mengelola strategi pemasaran yang efektif untuk mendukung tujuan bisnis. Tugas utamanya melibatkan pemahaman mendalam tentang pasar, analisis tren konsumen, dan implementasi kampanye pemasaran yang sukses. Spesialis Pemasaran juga bekerja sama dengan berbagai departemen, termasuk penjualan, produksi, dan manajemen produk, untuk memastikan konsistensi pesan dan pencapaian target penjualan.",4acb0b58-aa8a-41cf-9b23-01e918435d11,2024-02-01T00:00:00+07:00,6,WFO,Kab. Lombok Barat,[],5,5,"['Administrasi', 'Operasional', 'Kreatif', 'Komunikasi']",,False,True,False,False,False,False,,,
,1026b2ba-71eb-4c62-bf4a-2e57720842e1,"Influencer media sosial, konten kreator media sosial","membangun konten media sosial berupa digital flayer, video sebagai media promosi perusahaan. Melakukan branding di media sosial tentang program-program dan produk jasa CV. Hemispheres.",95a90d5d-5b47-4e56-9ae9-373a16ef58b3,2024-02-01T00:00:00+07:00,4,HYBRID,KABUPATEN SLEMAN,"['Jurnalisme, Komunikasi, dan Media', 'Teknik Informatika dan Ilmu Komputer', 'Seni dan Desain']",6,5,"['kreator', 'copy writing ', 'Content writing', 'fotografi', 'Videografi', 'market riset', 'seo']",,False,False,False,False,False,False,,,
,03ace609-0d67-4185-9b3e-25da225a6886,Asisten Project Manager Inkubasi Bisnis,"Perusahaan kami, Funvita Indonesia mencari seorang mahasiswa magang yang antusias dan bersemangat untuk bergabung dalam program magang pengembangan program baru dengan fokus pada inkubasi bisnis. Anda akan berperan dalam membantu tim pengembangan kami dalam merancang, mengembangkan, dan meluncurkan program inkubasi bisnis untuk produk atau layanan baru yang akan kami perkenalkan ke pasar. Magang ini akan memberikan Anda wawasan berharga tentang dunia pengembangan perangkat lunak, inkubasi bisnis, dan kolaborasi tim.Job Desk:• Mengidentifikasi keterampilan dan pengetahuan yang diperlukan oleh peserta inkubasi untuk sukses dalam penggunaan produk baru.• Mengumpulkan informasi dari berbagai sumber untuk menyusun materi pelatihan dan panduan inkubasi yang komprehensif.• Berkolaborasi dengan tim desain untuk mengembangkan materi visual yang menarik dan mendukung untuk program inkubasi.• Membantu dalam pengembangan platform atau alat yang diperlukan untuk pelaksanaan program inkubasi secara online atau tatap muka.• Berinteraksi dengan peserta inkubasi untuk memberikan panduan, menjawab pertanyaan, dan mengukur kemajuan mereka.• Mengumpulkan umpan balik dari peserta inkubasi dan melakukan perubahan yang diperlukan dalam program.• Membantu dalam mengatur dan melaksanakan sesi inkubasi, baik secara individu maupun kelompok.• Berpartisipasi dalam rapat tim untuk berbagi perkembangan, ide, dan tantangan yang dihadapi dalam pengembangan program",aee4712f-8196-400b-aa55-beb27ebdf49a,2024-02-01T00:00:00+07:00,6,WFH,Kab. Malang,[],4,4,"['Administrasi', 'Komunikasi', 'Operasional', 'Kreatif', 'Keterampilan Komunikasi']",,False,False,False,False,False,False,,,
,fef8f0de-02a1-49f4-97da-ea559fa23a2e,Grapich Desainer,"Job Desk Grapich Designer:Membuat desain informatif dan komunkatifMembuat desain untuk kebutuhan internal perusahaan seperti Flayer, Publikasi Kegiatan, Membuat Rencana Konten Planner, Label Produk, Banner Perusahaan, Id Card, dan LanyardMembuat konsep dari segala informasi dan material yang diberikan oleh klien atau unit bisnis perusahaanMenyelesaikan proyek serta mengkoordinasikannya dengan pihak luar, seperti agency, dinas terkait, percetakan, dan lain-lainMembuat ilustrasi atau gambar yang mengidentifikasikan pesan dari sebuah produk yang ingin dipasarkanMelakukan quality check terhadap ilutrasi sebelum dicetak atau dipublikasikanMelakukan brainstorming bersama tim dan memberikan masukan atas desain yang ingin dibuat sesuai dengan target market atau audiens yang ingin disasar",aee4712f-8196-400b-aa55-beb27ebdf49a,2024-02-01T00:00:00+07:00,6,WFH,Kab. Malang,[],3,4,"['Komunikasi', 'Kreatif', 'Kerjasama Tim', 'Desain Grafis', 'Digital Marketing', 'Keterampilan Komunikasi', 'Pengelolaan Waktu', 'Pemasaran Produk']",,False,False,False,False,False,False,,,
,fd3cd6c2-3e95-45ae-b7d5-90b817d7f40e,Human Resources Development,Melakukan Listing Paid Promote Lowongan KerjaMelakukan Screening CVMelakukan Interview Tahap AwalMelakukan Listing Kandidat Asessment,6d2039a4-7334-4066-8b94-1b8edbc206f0,2024-02-01T00:00:00+07:00,5,WFH,Kota Jakarta Utara,"['Psikologi', 'Manajemen', 'Hukum dan Politik']",3,0,"['Komunikasi', 'Kreatif', 'Pengelolaan Waktu']",,False,True,False,False,False,False,,,
,e1cf6b2b-a0f8-4544-8820-696ab40d32ed,Quality Assurance Developer - InternPro,"Sebagai Magang Quality Assurance Developer, Anda akan menjadi bagian integral dari tim pengembangan perangkat lunak kami, memastikan bahwa produk yang dihasilkan memenuhi standar kualitas tinggi sepanjang siklus pengembangan. Selama magang ini, Anda akan memahami proses pengujian perangkat lunak dan berkontribusi dalam memastikan kehandalan, keamanan, dan kualitas keseluruhan produk.",37b2f41c-48f9-44b8-ba4d-f54e88f431ab,2024-02-01T00:00:00+07:00,5,WFH,Kota Malang,[],5,5,"['Problem Solving', 'Kerjasama Tim', 'Pemahaman Teknologi Informasi']",,False,False,False,False,False,False,,,
,b9cdd770-b60b-4de6-a2a1-95189a9c7884,Front End Web Developer - InternPro,"Sebagai Magang Front End Web Developer, Anda akan bergabung dengan tim kreatif pengembangan perangkat lunak kami untuk membangun antarmuka pengguna yang menarik dan responsif. Selama magang ini, Anda akan terlibat dalam proses desain dan implementasi elemen-elemen visual dari aplikasi web, fokus pada sisi pengguna.",37b2f41c-48f9-44b8-ba4d-f54e88f431ab,2024-02-01T00:00:00+07:00,5,WFH,Kota Malang,[],10,5,"['Keterampilan Komunikasi', 'Kreativitas', 'Problem Solving', 'Kerjasama Tim', 'Pemahaman Teknologi Informasi']",,False,False,False,False,False,False,,,
,e864f075-0283-4032-a2e8-208f0201924a,Product Manager - SchoolTech,"Sebagai Magang Product Manager, Anda akan terlibat dalam pengelolaan dan pengembangan produk, memahami kebutuhan pelanggan, serta bekerja sama dengan berbagai tim untuk membawa produk ke tingkat yang lebih tinggi. Selama magang ini, Anda akan mendapatkan pemahaman mendalam tentang siklus hidup produk dan keterlibatan langsung dalam membuat keputusan strategis yang mempengaruhi kesuksesan produk.",37b2f41c-48f9-44b8-ba4d-f54e88f431ab,2024-02-01T00:00:00+07:00,5,WFH,Kota Malang,[],3,5,"['Innovation', 'Kreatif', 'Keterampilan Komunikasi', 'Kerjasama Tim', 'Problem Solving']",,False,False,False,False,False,False,,,
,4a70bcd3-f5bf-4496-a892-92893c1f100c,Backend Web Developer - InternPro,"Sebagai Magang Backend Web Developer, Anda akan bergabung dengan tim pengembangan perangkat lunak kami dan mendapatkan pengalaman langsung dalam mengembangkan bagian inti dari aplikasi web yang kuat dan efisien. Magang ini akan memberi Anda peluang untuk memahami proses pengembangan perangkat lunak secara menyeluruh, dari perencanaan hingga implementasi, sambil fokus pada pengembangan backend.",37b2f41c-48f9-44b8-ba4d-f54e88f431ab,2024-02-01T00:00:00+07:00,5,WFH,Kota Malang,[],10,0,[],,False,False,False,False,False,False,,,
,fc000acf-2901-495e-bcc7-427eef1a39ca,Content Creator,"Kami mencari mahasiswa berbakat yang ingin menjelajahi dunia konten kreatif. Magang ini merupakan kesempatan untuk membawa ide-ide segar Anda menjadi kenyataan, menghasilkan konten yang memikat dan bermakna untuk audiens yang luas.Sebagai Content Creator di SINTESIA, Anda akan memiliki kesempatan untuk:Pengembangan Konten: Berperan aktif dalam menciptakan konten-konten yang kreatif dan bermakna, mulai dari tulisan artikel, desain grafis, hingga produksi konten multimedia yang menginspirasi.Riset Mendalam: Melakukan riset yang teliti untuk memahami audiens dan tren terkini dalam industri konten kreatif guna menghasilkan konten yang relevan dan menarik.Kolaborasi Tim: Berpartisipasi dalam sesi brainstorming, berkolaborasi dengan tim kreatif, dan memberikan kontribusi pada strategi konten secara keseluruhan.Mengelola Jangkauan: Mempelajari praktik-praktik terbaik dalam pengelolaan dan optimisasi konten di berbagai platform, serta memantau kinerja konten untuk mencapai target jangkauan.Penggunaan Tools Kreatif: Menguasai dan memanfaatkan berbagai tools kreatif seperti perangkat lunak desain grafis, pengeditan video, dan platform manajemen konten.Keterampilan Komunikasi: Menulis dengan jelas dan persuasif, serta memiliki kemampuan komunikasi visual yang kuat untuk menghadirkan pesan yang menarik.Pemeliharaan Branding: Mendukung dan memperkuat konsistensi branding melalui konten yang dihasilkan.Belajar dan Berkembang: Memanfaatkan peluang magang sebagai waktu untuk belajar dan berkembang dalam industri konten kreatif, mendapatkan umpan balik, serta menerima mentorship dari para profesional berpengalaman.""",680b321e-468d-4150-86e8-2292bca07527,2024-02-01T00:00:00+07:00,3,WFH,Kab. Sukoharjo,[],3,0,"['Komunikasi', 'Operasional', 'Riset', 'Desain Grafis', 'Analisis Data', 'Pengembangan Strategi', 'Problem Solving', 'Manajemen Proyek']",,False,False,False,False,False,False,,,
,4afa51d0-6e57-4078-aa80-7fe150329a45,Social Media Content Creator,"Our Mission at PhotoSolve is to transform learning by helping every student succeed in school using the power of AI.PhotoSolve is an Indonesian fast-growing EdTech company, serving students worldwide. Powered by advanced machine learning technology, the app instantly scans, accurately solves, and intuitively explains printed and handwritten questions in any language.We are seeking a creative Social Media Content Manager to create video content for PhotoSolve’s social media presence on TikTok and Instagram Reels.The ideal candidate is highly creative and self-motivated, has excellent communication skills, and collaborates well with others.What you’ll do…Create entertaining, iconic content for PhotoSolve’s social media that people want to shareWork on crafting fun, educational content that helps further our mission of developing the best education in the world and making it accessibleConceptualize, script, produce, and shoot short-form video content for our social channels, primarily TikTok, Instagram Reels, and YouTubeEvolve our short-form video strategy with an eye towards quantitative analysis: run lots of content experiments and iterate on the ones that work.Internship Benefit...🧑‍💻 Opportunity to be a Part-Time Team with a Salary of Rp2–3 Million per Month.🌎 Online/Offline work flexibility (mainly online, flexible hours) with performance-based incentives.🌟 International Internship Certificate in dual languages (English & Indonesian) at the end of the internship period.📝 Full-Time Job Recommendation Letter & LinkedIn Recommendation.👥 Team bonding & relationship building (Networking).🌐 Access to a global network, enhancing your professional connections and industry exposure.What we’re looking for…Active College Students.Video production experience – you’re intimately familiar with in-app creator tools across social platforms and know your way around a video editing software like CapCut.In-tune with social trends, even before they hit; ability to respond ASAP to trends/memes to capitalize on those opportunitiesSolid interpersonal skills and passion for engaging with our social media communitiesProficient in both English and Indonesian.Please include a link to your portfolio / social media on the CV showcasing relevant work samples.",0d4b20a5-578a-43cc-84fa-19f33bae699b,2024-02-01T00:00:00+07:00,4,HYBRID,Kota Depok,[],3,1,['Kreatif'],,True,True,False,False,False,False,,,2000000.0
,032cb5f3-fff8-4390-80e9-10cedc1bf44b,Legal Intern,"Sebagai Legal Intern, Anda akan bekerja di bawah bimbingan langsung dari tim hukum kami dan mendapatkan pengalaman langsung dalam berbagai aspek hukum perusahaan. Magang ini bertujuan untuk memberikan pemahaman mendalam tentang praktek hukum di industri kami.Tanggung Jawab Utama:Penelitian HukumPemantauan dan Analisis HukumPemilihan dan Penyusunan Dokumen HukumPartisipasi dalam Pertemuan HukumPemberian Saran HukumKerjasama TimPelaporan dan Dokumentasi",a74a49d5-59b9-4628-bd68-e5723bcb9df9,2024-02-01T00:00:00+07:00,6,HYBRID,Kota Jakarta Selatan,"['Hukum dan Politik', 'Akuntansi dan Perpajakan']",3,0,"['Administrasi', 'Komunikasi', 'Operasional', 'Hukum', 'Kerjasama Tim', 'Akutansi', 'Pajak', 'Regulasi', 'Profesi Hukum']",,False,False,False,False,False,False,,,
,24b72885-5677-4a48-9bf6-5064ce03702c,Fasilitator Kelas/Tenaga Pengajar,"Bantuan dalam Pengajaran dan Pembelajaran: Mahasiswa akan merencanakan, menyusun, dan menyampaikan materi pembelajaran sesuai dengan pendekatan sekolah alam atau Montessori. Mereka akan terlibat dalam memfasilitasi kegiatan belajar siswa, seperti diskusi kelompok, eksperimen, atau proyek kreatif. Pengembangan Bahan Ajar: Mahasiswa akan terlibat dalam mengembangkan bahan ajar yang sesuai dengan prinsip-prinsip pendidikan alternatif, termasuk materi pelajaran, aktivitas pembelajaran, dan sumber daya pendukung lainnya. Mereka akan belajar untuk menyusun bahan ajar yang menarik dan sesuai dengan kebutuhan serta minat siswa. Pendampingan Siswa: Mahasiswa akan menjadi pendamping bagi siswa dalam proses belajar mereka. Mereka akan membantu siswa yang membutuhkan bantuan tambahan dalam memahami materi pelajaran, mendorong partisipasi aktif, dan memberikan dukungan emosional saat diperlukan.  Pelaksanaan Kegiatan Ekstrakurikuler: Mahasiswa akan membantu dalam menyelenggarakan kegiatan ekstrakurikuler yang mendukung pengembangan siswa secara holistik, seperti kegiatan seni, olahraga, atau lingkungan. Mereka akan berperan sebagai fasilitator atau pengawas untuk memastikan keberlangsungan dan keberhasilan kegiatan tersebut. Penilaian dan Umpan Balik: Mahasiswa akan terlibat dalam proses penilaian kinerja siswa, baik dalam bentuk pengamatan langsung maupun penilaian formatif. Mereka akan membantu dalam memberikan umpan balik konstruktif kepada siswa untuk membantu mereka meningkatkan prestasi akademik dan perilaku belajar.  Kolaborasi Tim: Mahasiswa akan bekerja sama dalam mengembangkan dan melaksanakan program-program pendidikan yang komprehensif. Mereka akan berpartisipasi dalam pertemuan tim, diskusi, dan perencanaan bersama untuk memastikan keterpaduan dan kesinambungan program.Pembelajaran Berkelanjutan: Selama magang, mahasiswa akan memiliki kesempatan untuk mengikuti pelatihan dan workshop yang diselenggarakan oleh sekolah atau lembaga pendidikan terkait untuk meningkatkan keterampilan mereka dalam mendukung proses pembelajaran dan pengajaran yang efektif.  ",4bb9c2e3-c5a7-4e99-bc52-0f30bf2fd1e5,2024-03-01T00:00:00+07:00,4,WFO,Banda Aceh,[],14,5,"['Administrasi', 'Komunikasi', 'Operasional', 'Kreatif']",,False,False,False,False,False,False,,,
,07fb7e4b-f88e-4399-824b-17a2c17a9478,Asisten Pengembangan Program Filantropi,"Sebagai Asisten Pengembangan Program Filantropi, Anda akan terlibat dalam mendukung proses perencanaan, pengembangan, dan pelaksanaan program-program filantropi yang bertujuan untuk memperoleh dukungan keuangan dari berbagai pihak. Tugas Anda akan melibatkan kolaborasi dengan tim pengembangan, penyusunan proposal, riset program, dan berbagai kegiatan terkait untuk mencapai tujuan filantropi organisasi.Tanggung Jawab Utama:·   Penyusunan Proposal:·   Berkontribusi dalam penyusunan proposal-proposal filantropi untuk mendukung program-program organisasi.·   Memastikan proposal sesuai dengan pedoman dan kebutuhan pendanaan.·   Riset Program:·   Melakukan riset mendalam terkait isu-isu yang dihadapi oleh program-program filantropi.· …",4bb9c2e3-c5a7-4e99-bc52-0f30bf2fd1e5,2024-03-01T00:00:00+07:00,4,WFH,Banda Aceh,[],3,6,[],,False,False,False,False,False,False,,,
