meta,id,name,description,mitra_id,start_period,months_duration,activity_type,location,fields_of_study,quota,min_semester,skills,web_portal,show_salary,mobilization,accommodation,is_applied,wishlist,is_external,external_platform_name,external_platform_logo_url,salary
,b794e1a1-ecd6-449d-9ed9-0118a2e02626,Website Developer,Kualifikasi : Wajib memiliki laptop sendiri.Mampu membuat website dan landing page sesuai dengan kebutuhan perusahaan Mampu  Optimasi SEOMasa magang minimum 3 bulan dengan jam kerja normalHarus menyertakan portofolioBenefit :Sertifikat Magang Konversi NilaiSistem WFH,c7746ff1-87de-47bb-a43f-6d63f521e07c,2024-03-01T00:00:00+07:00,3,WFH,Kota Surabaya,[],2,0,"['Komunikasi', 'Kreatif', 'Pemahaman Industri', 'Manajemen Proyek', 'Kreativitas', 'Kerjasama Tim', 'Keahlian Teknologi', 'Pemasaran Produk']",,False,False,False,False,False,False,,,
,7c8623ef-5f9b-470d-bc7a-73b1dd706c8b,Software Architect Intern,To help architect team on demonstration of an improvement idea in which work is focused on determining whether an idea can be turned into a reality.The improvement might include:- Test Optimization- Test Automation- Framework usage e.g Test framework or design,af00bd20-3ac2-44a4-877f-af4307f9b599,2024-03-01T00:00:00+07:00,6,WFO,Kota Jakarta Selatan,['Teknik Informatika dan Ilmu Komputer'],1,6,"['Komunikasi', 'Kreatif', 'Desain Grafis', 'Coding']",,False,False,False,False,False,False,,,
,bd95c730-b157-4fc5-8791-9dc9ea5e0e32,Product Marketing Intern,- Design and develop sharepoint page to support the business operation.- Collaborate with other team to get the data for the sharepoint page.- Support for the documentation on our products.- Willing to learn new things.,af00bd20-3ac2-44a4-877f-af4307f9b599,2024-03-01T00:00:00+07:00,6,WFO,Kota Jakarta Selatan,['Teknik Informatika dan Ilmu Komputer'],1,6,"['Kreatif', 'Analisis Data', 'Pemahaman Lingkungan Bisnis', 'Komunikasi']",,False,False,False,False,False,False,,,
,fc01895c-0d74-4874-a8f2-d1d46956d697,Asisten Finance,"Pemahaman Sistem Keuangan Sekolah: Anda akan diajak untuk memahami sistem keuangan yang digunakan oleh sekolah, termasuk proses pembayaran, pelaporan keuangan, dan pengelolaan anggaran.Pencatatan Transaksi Keuangan: Anda akan belajar untuk melakukan pencatatan transaksi keuangan harian, seperti penerimaan uang sekolah, pembayaran gaji pegawai, pembelian perlengkapan sekolah, dan pembayaran tagihan.Pengelolaan Kas: Anda mungkin akan terlibat dalam mengelola kas sekolah, termasuk penyusunan laporan arus kas, pengecekan saldo kas, dan memastikan keakuratan pencatatan transaksi kas.Penyusunan Laporan Keuangan: Anda akan membantu dalam penyusunan laporan keuangan bulanan atau tahunan, seperti laporan laba rugi, neraca, dan laporan arus kas. Ini melibatkan pengumpulan data, pengecekan keakuratan, dan penyusunan laporan sesuai dengan standar akuntansi yang berlaku.Pemahaman Pengeluaran dan Pemasukan Sekolah: Anda akan belajar tentang sumber pendapatan sekolah, seperti biaya sekolah, dana donasi, dan subsidi pemerintah, serta pengeluaran untuk operasional sekolah, termasuk pembayaran gaji staf, pembelian perlengkapan, dan biaya pemeliharaan gedung.Berkomunikasi dengan Pihak Terkait: Anda mungkin akan berinteraksi dengan pihak terkait, seperti guru, staf administrasi, orang tua siswa, dan pihak eksternal seperti bank atau vendor, untuk membahas masalah keuangan dan administrasi sekolah.Partisipasi dalam Rapat dan Pertemuan: Anda mungkin akan diminta untuk menghadiri rapat atau pertemuan internal yang membahas masalah keuangan dan administrasi sekolah, serta memberikan kontribusi atau presentasi sesuai dengan bidang Anda.Penyusunan Anggaran: Anda dapat terlibat dalam penyusunan anggaran tahunan sekolah, yang melibatkan perencanaan pengeluaran dan pendapatan, serta evaluasi kinerja keuangan secara periodik.Pembelajaran Sistem Perangkat Lunak Keuangan: Jika sekolah menggunakan sistem perangkat lunak keuangan tertentu, Anda akan diajarkan untuk mengoperasikan dan memahami fungsi-fungsi dasar dari sistem tersebut.Proyek Khusus: Terkadang, Anda mungkin juga akan diberi tanggung jawab untuk menyelesaikan proyek khusus terkait dengan keuangan dan administrasi sekolah, seperti evaluasi efisiensi operasional, penyusunan kebijakan keuangan, atau implementasi sistem baru.",0bf5a4d1-9980-48ae-ad65-48e3b239f15c,2024-03-01T00:00:00+07:00,4,WFO,Kota Banda Aceh,[],2,4,"['Administrasi', 'Operasional', 'Komunikasi', 'Kreatif']",,False,False,False,False,False,False,,,
,b6062e51-4764-474c-a2b7-617affd56959,Marketing Asuransi Mini Mikro ,"WFH dari Seluruh Indonesia.Penelitian Pasar: Mahasiswa akan diajak untuk melakukan penelitian pasar terkait produk asuransi mikro yang ditawarkan oleh perusahaan. Ini meliputi menganalisis target pasar, memahami kebutuhan dan preferensi calon pelanggan, serta mengevaluasi pesaing di pasar.Pengembangan Strategi Pemasaran: Mahasiswa akan terlibat dalam proses pengembangan strategi pemasaran untuk produk asuransi mikro. Mereka akan belajar tentang penggunaan berbagai saluran pemasaran, promosi, dan komunikasi untuk meningkatkan kesadaran dan minat calon pelanggan.Penyusunan Materi Promosi: Mahasiswa akan membantu dalam penyusunan materi promosi seperti brosur, leaflet, presentasi, dan konten media sosial. Mereka akan belajar bagaimana menyusun pesan yang menarik dan persuasif untuk menarik minat pelanggan potensial.Pelatihan Tim Penjualan: Mahasiswa akan diberi kesempatan untuk mengamati dan bahkan terlibat dalam pelatihan tim penjualan. Mereka akan mempelajari teknik penjualan yang efektif, keterampilan presentasi, dan cara mengatasi penolakan dari calon pelanggan.Pelaksanaan Kampanye Pemasaran: Mahasiswa akan terlibat dalam pelaksanaan kampanye pemasaran untuk produk asuransi mikro, baik secara langsung maupun melalui media online. Ini bisa mencakup kegiatan seperti pameran, acara promosi, dan kampanye digital.Analisis Kinerja: Mahasiswa akan belajar tentang pentingnya analisis kinerja dalam pemasaran. Mereka akan terlibat dalam memantau dan mengevaluasi efektivitas berbagai kegiatan pemasaran yang dilakukan, serta membuat rekomendasi untuk perbaikan di masa mendatang.Pelayanan Pelanggan: Mahasiswa akan mendapatkan pemahaman tentang pentingnya pelayanan pelanggan dalam industri asuransi. Mereka akan belajar tentang cara menangani pertanyaan, keluhan, dan klaim pelanggan dengan baik dan efisien.",6bbc729e-c3ee-46a1-93be-2b9f3b5f478d,2024-03-01T00:00:00+07:00,4,WFH,Kota Banda Aceh,[],50,3,"['Operasional', 'Kreatif', 'Administrasi', 'Komunikasi']",https://forms.gle/7SSUSeRFa6UQT2Fe6,False,False,False,False,False,False,,,
,051db4ac-8eb2-4f06-be00-36d6e4649c4a,Marketing Asuransi Mini Mikro ,"WFH dari Seluruh Indonesia.Penelitian Pasar: Mahasiswa akan diajak untuk melakukan penelitian pasar terkait produk asuransi mikro yang ditawarkan oleh perusahaan. Ini meliputi menganalisis target pasar, memahami kebutuhan dan preferensi calon pelanggan, serta mengevaluasi pesaing di pasar.Pengembangan Strategi Pemasaran: Mahasiswa akan terlibat dalam proses pengembangan strategi pemasaran untuk produk asuransi mikro. Mereka akan belajar tentang penggunaan berbagai saluran pemasaran, promosi, dan komunikasi untuk meningkatkan kesadaran dan minat calon pelanggan.Penyusunan Materi Promosi: Mahasiswa akan membantu dalam penyusunan materi promosi seperti brosur, leaflet, presentasi, dan konten media sosial. Mereka akan belajar bagaimana menyusun pesan yang menarik dan persuasif untuk menarik minat pelanggan potensial.Pelatihan Tim Penjualan: Mahasiswa akan diberi kesempatan untuk mengamati dan bahkan terlibat dalam pelatihan tim penjualan. Mereka akan mempelajari teknik penjualan yang efektif, keterampilan presentasi, dan cara mengatasi penolakan dari calon pelanggan.Pelaksanaan Kampanye Pemasaran: Mahasiswa akan terlibat dalam pelaksanaan kampanye pemasaran untuk produk asuransi mikro, baik secara langsung maupun melalui media online. Ini bisa mencakup kegiatan seperti pameran, acara promosi, dan kampanye digital.Analisis Kinerja: Mahasiswa akan belajar tentang pentingnya analisis kinerja dalam pemasaran. Mereka akan terlibat dalam memantau dan mengevaluasi efektivitas berbagai kegiatan pemasaran yang dilakukan, serta membuat rekomendasi untuk perbaikan di masa mendatang.Pelayanan Pelanggan: Mahasiswa akan mendapatkan pemahaman tentang pentingnya pelayanan pelanggan dalam industri asuransi. Mereka akan belajar tentang cara menangani pertanyaan, keluhan, dan klaim pelanggan dengan baik dan efisien.",6bbc729e-c3ee-46a1-93be-2b9f3b5f478d,2024-03-01T00:00:00+07:00,4,WFH,Kota Banda Aceh,[],50,3,"['Operasional', 'Kreatif', 'Administrasi', 'Komunikasi']",https://forms.gle/7SSUSeRFa6UQT2Fe6,False,False,False,False,False,False,,,
,0ffe8c67-45e8-473f-a82d-175f4ad7fcb8,Tenaga Pengajar DIGIKIDZ,"-      Sebagai Multimedia Coach, akan mengajar di Children Creative Learning Center DIGIKIDZ, baik di center, sekolah, center franchise (jika ada) dan event2 yang dilaksanakan DIGIKIDZ -      Melakukan persiapan mengajar sesuai kelas yang dijadwalkan minimal 30 menit sebelum kelas dimulai dengan menggunakan Teaching Aids, Video Tutorial dan alat bantu mengajar lain sesuai standard DIGIKIDZ-      Melaksanakan persiapan mengajar, pengajaran di kelas dan perapian setelah mengajar sesuai Standard Operational Procedure (SOP)-      Mengajar dengan HATI : menjalankan kelas yang menyenangkan (fun learning), kreatif menyiasati murid dan suasana kelas dan terstruktur sesuai dengan SOP.-      Melaksanakan pekerjaan administrasi yang berkaitan dengan jalannya kelas secara tepat waktu dan tertib sesuai SOP. Misalnya : pengisian Absensi Murid, Evaluation Sheet, pembuatan Progress Report dan Sertifikat Murid-      Melakukan koordinasi internal dengan team Coach lain atau team marketing masing-masing center agar semua kelas dapat berjalan dengan baik-      Melakukan komunikasi dengan murid ataupun Orang Tua Murid terkait perkembangan belajar murid.-      Menjaga MUTU KELAS yang diajar sesuai dengan KURIKULUM DIGIKIDZ yang berlaku-      Melaporkan semua hal yang terkait dengan pekerjaan kepada Center Coordinator/Supervisor, terutama masalah-masalah yang muncul di kelas baik di center dan sekolah",0fc9e97a-2c73-463e-8c4e-4a6a5d596f3f,2024-03-01T00:00:00+07:00,6,WFO,Kota Tangerang Selatan,[],10,4,[],,False,False,False,False,False,False,,,
,7516bf97-bdfc-4dd1-875e-069253eb0a76,Content Creator,Membuat konten Tentang DIGIKIDZMenganalisis target Customer DIGIKIDZMembuat Strategi brandingMengelola platform DIGIKIDZUpdate terhadap perkembangan Teknologi terbaruMemonitor kinerja kontenMembangun jaringan dan kemitraan,0fc9e97a-2c73-463e-8c4e-4a6a5d596f3f,2024-03-01T00:00:00+07:00,9,WFO,Kota Tangerang Selatan,[],3,4,[],,False,False,False,False,False,False,,,
,6f0633b9-8300-4c76-a839-daa5c6dc5670,Admin,"Tenaga Administrasi Membantu DIVISI Marketing, Finance, Product Development, dan DIVISI lainnya dalam merencanakan dan rekapitulasi AdministrasiMembantu DIVISI human Resource dalan hal Pengelolaan Administrasi Membantu Team Finance untuk rekapitulasi pencatatan keuangan keuangan ",0fc9e97a-2c73-463e-8c4e-4a6a5d596f3f,2024-03-01T00:00:00+07:00,6,WFO,Kota Tangerang Selatan,[],3,4,"['Administrasi', 'Kreatif', 'Komunikasi', 'Operasional', 'Analisis Keuangan', 'Analisis Data']",,False,False,False,False,False,False,,,
,ef46090e-092b-4cdf-bfb5-f3f54d6e23de,Internship Multimedia Coach,"-      Sebagai Multimedia Coach, akan mengajar di Children Creative Learning Center DIGIKIDZ, baik di center, sekolah, center franchise (jika ada) dan event2 yang dilaksanakan DIGIKIDZ -      Melakukan persiapan mengajar sesuai kelas yang dijadwalkan minimal 30 menit sebelum kelas dimulai dengan menggunakan Teaching Aids, Video Tutorial dan alat bantu mengajar lain sesuai standard DIGIKIDZ-      Melaksanakan persiapan mengajar, pengajaran di kelas dan perapian setelah mengajar sesuai Standard Operational Procedure (SOP)-      Mengajar dengan HATI : menjalankan kelas yang menyenangkan (fun learning), kreatif menyiasati murid dan suasana kelas dan terstruktur sesuai dengan SOP.-      Melaksanakan pekerjaan administrasi yang berkaitan dengan jalannya kelas secara tepat waktu dan tertib sesuai SOP. Misalnya : pengisian Absensi Murid, Evaluation Sheet, pembuatan Progress Report dan Sertifikat Murid-      Melakukan koordinasi internal dengan team Coach lain atau team marketing masing-masing center agar semua kelas dapat berjalan dengan baik-      Melakukan komunikasi dengan murid ataupun Orang Tua Murid terkait perkembangan belajar murid.-      Menjaga MUTU KELAS yang diajar sesuai dengan KURIKULUM DIGIKIDZ yang berlaku-      Melaporkan semua hal yang terkait dengan pekerjaan kepada Center Coordinator/Supervisor, terutama masalah-masalah yang muncul di kelas baik di center dan sekolah",0fc9e97a-2c73-463e-8c4e-4a6a5d596f3f,2024-03-01T00:00:00+07:00,6,WFO,Kota Tangerang Selatan,"['Teknik Elektro', 'Teknik Informatika dan Ilmu Komputer', 'Pendidikan', 'Seni dan Desain', 'Jurnalisme, Komunikasi, dan Media', 'Lainnya']",10,4,"['Desain Grafis', 'Pemahaman Industri', 'Keahlian Teknologi', 'Pemahaman Teknologi Informasi', 'Keterampilan Komunikasi']",,False,False,False,False,False,False,,,
,56f38ac4-b000-4f58-84df-4996ef7e8a57,Developer,"Melakukan proses perbaikan, pengembangan, perubahan, dan peningkatan pada sebuah aplikasi dengan cara yang efesien, mudah dimengerti dan minim BUG.Berkontribusi dalam semua fase SDLC.Membuat dokumentasi Teknis atas proses perbaikan, pengembangan, perubahan, dan peningkatan yang dikerjakan.",1c3e5f26-9f5d-4266-b5b1-8d152c20cdac,2024-05-01T00:00:00+07:00,6,WFO,Kota Jakarta Barat,"['Teknik Informatika dan Ilmu Komputer', 'Teknik Industri', 'Matematika']",2,5,"['Pemahaman Teknologi Informasi', 'Pemahaman Industri', 'Kerjasama Tim', 'Keahlian Teknologi', 'Problem Solving']",,False,False,False,False,False,False,,,
,3fb69535-5f45-494b-9e6a-cee8b3dabdca,SEO Specialist,"Membangun dan mengimplementasi strategi SEO untuk meningkatkan organic trafficMengidentifikasi keyword dan membuat artikel/konten website yang menghasilkan traffic yang tinggiMelakukan optimasi on-site untuk meningkatkan Click Through Rate (CTR)Monitoring dan mengevaluasi SEO performance berdasarkan key metricsMelakukan riset kata kunci menggunakan tools SEO seperti, Ahrefs, Google Trends, Keyword Planner, dan SemrushMenganalisa website baik dari sudut pandang mesin pencari dan user untuk memaksimalkan optimasi websiteMembuat laporan secara terperinci mengenai kinerja website yang sudah dioptimasiMeningkatkan serta mempertahankan aspek seperti profil, traffic dan interaksi dengan pengguna yang menentukan ranking web di mesin pencarianMengkoordinasikan segala hal yang berkaitan dengan digital marketing channelBerkolaborasi dengan tim Content Writer dalam pembuatan desain content",0530bacf-18ce-4cb5-8315-b26c8dce47d1,2024-03-01T00:00:00+07:00,4,HYBRID,Kab. Malang,[],2,0,"['SEO', 'Analythic Skills', 'Critical Thinking']",https://career.sekawanmedia.co.id/magang/,True,False,False,False,False,False,,,300000.0
,16a54d42-57ad-4857-aa57-0f4c532eec4a,Content Writer,Membuat dan merancang content planning setiap bulanMembuat konten artikel di halaman blog sesuai standar SEO friendlyMengelola artikel di WordPressMengerjakan aktivitas keyword research untuk optimasi kontenMembuat report untuk analisa performa website,0530bacf-18ce-4cb5-8315-b26c8dce47d1,2024-03-01T00:00:00+07:00,4,HYBRID,Kab. Malang,[],2,0,"['SEO Writing', 'Content Writing', 'Wordpress', 'Google Workspace']",https://career.sekawanmedia.co.id/magang/,True,False,False,False,False,False,,,300000.0
,28356c77-697b-4b6d-8dcb-2e25cac9f738,Visual Designer,"Position: Intern - Visual DesignerInternship Period: March - July 2024---Key Responsibilities:1.    Collaborate with the creative team to conceptualize and design visually appealing graphics for various projects.2.    Assist in creating marketing materials, including social media graphics, promotional banners, and other visual content.3.    Work with design software to bring ideas to life and ensure a cohesive visual identity.4.    Support the development of engaging and innovative designs for digital and print media.5.    Contribute to brainstorming sessions and provide creative input for design projects.6.    Assist in maintaining brand consistency across all visual elements.---Qualifications:1.    Currently enrolled in a relevant undergraduate program (Graphic Design, Visual Communication, Fine Arts, or related fields).2.    Proficiency in graphic design software such as Adobe Creative Suite (Photoshop, Illustrator, InDesign).3.    Strong creativity and a keen eye for detail in visual design.4.    Passion for staying updated with design trends and emerging technologies.5.    Excellent communication and collaboration skills.6.    Ability to work within a team and take constructive feedback positively.---Benefits:1.    Gain hands-on experience in graphic design within a dynamic creative environment.2.    Work closely with a supportive team and learn from experienced professionals.3.    Opportunity for skill development and networking within the creative industry.4.    Certificate of Internship upon successful completion.---We are excited to welcome passionate individuals who are eager to contribute their creative flair to the world of design at PT. Shakran Kreasi Indonesia.---PT. Shakran Kreasi Indonesia Jalan Kyai Ahmad Sahid, Pokoh, Wedomartani, Ngemplak, Sleman Yogyakarta, Indonesia. 55584 https://shakrankreasi.com/karirE-mail: karir@shakrankreative.com cc: creative@shakrankreasi.com",0487b1fb-7fc5-4786-a9a4-2ad82c18c640,2024-03-01T00:00:00+07:00,5,HYBRID,Kab. Sleman,"['Jurnalisme, Komunikasi, dan Media', 'Seni dan Desain']",3,6,"['Komunikasi', 'Operasional', 'Kreatif', 'Administrasi']",,False,False,False,False,False,False,,,
,e0a8e3bf-d372-45be-b666-0a374193c014,Tech Writer,"General RequirementsPendidikan minimal SMA/SMK-sederajat, D3/S1 semua jurusanMemiliki laptop pribadiLama Magang minimal 4 bulanPenempatan di Kota MalangDapat bekerja secara individu ataupun timMemiliki kemampuan berbahasa Inggris cukup (verbal maupun oral)Menguasai berbagai program Microsoft OfficeMampu berkomunikasi dengan baikMampu dalam membuat dokumen kebutuhan projectLatar belakang jurusan Informatika/Sistem InformasiMemiliki pengetahuan dan keterampilan teknologi komputer, bahasa pemrograman dan teknik pengolahan dataMemiliki keterampilan dalam menggunakan alat dan teknik untuk mengembangkan aplikasi software dan hardware, teknologi komunikasi data, bahasa-bahasa pemrograman, dan sistem operasiMemiliki pengetahuan tentang user atau bisnis secara umumMampu mengoperasikan draw.io dan FigmaJob DescriptionMembuat dokumen teknis aplikasi seperti business process, user flow dan lainnya sesuai arahan system analystMembuat laporan/dokumentasi projectMembuat panduan/guide produk/project",0530bacf-18ce-4cb5-8315-b26c8dce47d1,2024-03-01T00:00:00+07:00,4,HYBRID,Kab. Malang,[],2,0,"['Draw.Io', 'Figma', 'User Flow', 'Ms. Office']",https://career.sekawanmedia.co.id/magang/,True,False,False,False,False,False,,,300000.0
,6f8d76a0-9bf8-455b-8ae8-0f387c0ee53d,Manajerial Intern,"Peserta akan belajar dan acting as Supervisor di berbagai Departemen dan menjalankan tugas-tugas sebagai : a. Operasional (Cabang Klinik Gigi)b. Financec. Human Resources Developmentd. Purchasinge. Marketing Peserta berkesempatan untuk belajar sekaligus melaksanakan tugas-tugas managerial dibawah bimbingan orang-orang yang berpengalaman. Disediakan juga waktu khusus untuk konsultasi atau pembelajaran untuk mengembangkan kompetensi managerial.Peserta akan dilengkapi dan difasilitasi dengan Laptop Perusahaan. Jam Kerja :Hari Senin - Jumat08.00 - 17.00 WIBLokasi : Jalan Alternatif Cibubur, Ruko City Walk Citra Grand Blok CW 7 No.20 , Jatisampurna, Bekasi",1a8c4d72-33f3-4505-8abd-a13ad650c68d,2024-04-01T00:00:00+07:00,3,WFO,Kota Bekasi,"['Ekonomi', 'Kedokteran Gigi']",5,5,"['Administrasi', 'Operasional', 'Komunikasi', 'Kreatif', 'managerial']",recruitment.talenta.co/damessa/NXU0S0VlRldHaGdwcUZxb2lXS3lrdz09,True,True,True,False,False,False,,,1200000.0
,ba888e0a-a61e-471f-8e2b-32badfb8a32c,Internship Admin Finance_Yogyakarta,"Melakukan analisa transaksi keuangan day to dayMelakukan pemprosesan transaksi ke dashboard excelMelakukan dokumentasi evidence transaksi financeMelakukan pembuatan summary transaksi masuk dan keluar mingguanRequirement:Lulusan SMK akuntansi/perkantoran, atau mahasiswa tingkat akhir jurusan Administrasi Perkantoran atau AkuntansiBerpengalaman dalam bidang administratif/pengarsipanDapat mengoperasikan komputer dan basic ms officeRajin, teliti, cekatan, rapiKomunikatifBersedia Work From Office di kantor Yogyakarta",ebef4207-72ef-48e4-bc09-4c1fc00104c7,2024-03-01T00:00:00+07:00,3,WFO,Kota Yogyakarta,[],2,0,[],,False,False,False,False,False,False,,,
,e63e51d1-a68e-4980-ab35-6c7a9dfed3be,KOL Specialist Intern,"We are seeking a dynamic and enthusiastic individual to join our team as a KOL (Key Opinion Leader) Specialist Intern. This internship offers an exciting opportunity to gain hands-on experience in influencer marketing and digital branding within our organization, PT DIPDOP UNIVERSE CORP.Responsibilities:Identifying and Researching Key Opinion Leaders: Assist in identifying potential Key Opinion Leaders (KOLs) across various industries and social media platforms. Conduct research to evaluate their relevance, reach, and engagement with target audiences.Building and Maintaining Relationships: Support the KOL Specialist in establishing and maintaining relationships with identified influencers. Assist in communication efforts, including outreach, negotiation, and coordination of partnerships and collaborations.Content Coordination: Assist in coordinating content creation and delivery schedules with KOLs, ensuring alignment with brand objectives and messaging. Monitor content performance and provide insights for optimization.Campaign Support: Collaborate with cross-functional teams to support the execution of influencer marketing campaigns. Assist in campaign planning, tracking, and reporting activities.Market Analysis: Conduct market analysis and stay updated on industry trends and best practices in influencer marketing. Provide recommendations for enhancing influencer strategies and tactics.Qualifications:Currently enrolled in a Bachelor's or Master's degree program in Marketing, Communications, Business, or related field.Strong interest in influencer marketing, digital branding, and social media.Excellent communication and interpersonal skills.Detail-oriented with strong organizational and time management abilities.Proficiency in Microsoft Office suite (Word, Excel, PowerPoint).Ability to work independently as well as collaboratively in a team environment.Duration:This internship is a [3]-month commitment, with the possibility of extension based on performance and organizational needs. The internship will provide valuable hands-on experience and the opportunity to contribute to meaningful projects within our company.Benefits:Hands-on experience in influencer marketing and digital branding.Exposure to industry professionals and networking opportunities.Opportunity to contribute to impactful projects and campaigns.Mentorship and guidance from experienced professionals in the field.Potential for career advancement within the organization based on performance and availability of positions.Application Instructions:To apply for the KOL Specialist Intern position, please submit your resume and a cover letter outlining your interest in influencer marketing and why you are a suitable candidate for this internship. Additionally, include any relevant experience or coursework related to marketing, communications, or digital media.",921b872b-4268-4333-b5a0-dd3b814cc146,2024-03-01T00:00:00+07:00,3,WFH,Kab. Jember,[],5,0,[],,False,False,False,False,False,False,,,
